"","x"
"146","I had very little evidence on which to base the decision but there was a clear correlation between patients surviving if they had taken Batatrium so I presumed that it was 80% effective"
"147","Based on my memory, around 50% of the patients who took Batatrim were cured, as opposed to maybe 10% of patients of who didn;t take Batatrim being cured. That's a significant increase"
"148","I observed that a big percentage of people that were suffering from a crises and took Batatrim recovered from the crisis, however there was a small percentage of people that couldn't recover. On the other hand, the ones that didn't take Batatrim showed both results. The percentage of people that couldn't recover after not taking the Batatrim was bigger than the one that could recover without Batatrim, but it was still considerable. My initial thought about the Batatrim was that it could be around 65% effective, but with the scale available, where I couldn't put decimals I chose the value 7 of effectivity, rather than a 6, because a 6 value seemed too low."
"149","Because some patients did not overcome the crysis of linsday syndrome while some patients did"
"150","I considered the amount of times the patient overcame the crisis with/without Batatrim and whether they can overcome it without Batatrim."
"151","how many people survived after taking it vs not taking it"
"152","From what I saw most of the patients who has taken Batatrim has overcome the crisis, so I decided the drug is most likely effective."
"153","How many patients have taken Batatrim and didn't overcome the crisis"
"154","I considered the patients who were able to recover from the syndrome with the help of batatrim and those who failed to recover "
"155","The majority of patients who took the drug lived, while the majority of people who didn't died."
"156","To me, it was more visible how many patients were saved by the medicine and how many died without it. Thus, I believe in the effectiveness, even though I had a hard time after the first few times it did not work. I started doubting it, but many more rounds later, when I saw that it still saves lives, I realised it is definitely better to trust the medicine most of the times. "
"157","I just tried to summarize all of the patients who recovered or not. From the amount of the recovered patients, I think the Batatrim mostly works, but not everybody will survive. However, minority of the people didn't have to take Batatrim to survive, so this is hard to say if the deaths were caused by Batatrim's side effects or poor performance caused by early development stage."
"158","Most patients that took Batatrim overcame the crisis and most that didn't take Batatrim did not."
"159","Well sometimes it did help and sometimes it did not. 
It felt like it did help more often and the ones that did not take it, had more of the negative outcomes  than positive."
"160","The rate oh patients who had Batatrim and who had effective reaction"
"161","Most patients who used Batatrim were able to overcome the disease"
"162","In my opinion, there's a 50% chance that it will work or not, and I don't think it's really helpful "
"163","The number of patients that have overcome the crisis because they were given Batatrium. The reason was the result of the past questions and the frequency of patients given batatrium overcoming the crisis."
"164","I considered that fact that while still in its testing phase patient who had taken Batatrim stood a higher chance of overcoming the crisis even though it was guaranteed. And while there were patients who over came the crisis without it, there weren't enough to dismiss Batatrim increased probability of aiding the patients ability to overcome the Lindsay syndrome."
"165","I noticed that most patients who took it recovered and most of those that did not they did not recover"
"166","Some patients who took Batatrim did not overcome the crisis, and similarly, some patients who did not take Batatrim did manage to overcome it. However, in most cases, patients who took Batatrim were able to overcome the crisis. Conversely, those who did not take Batatrim generally did not overcome the crisis."
"167","according to the results it is shown that patients are likely to overcome a crisis when they have taken batatrim as opposed to not taking it."
"168","the amount of patients that overcame the crises after using batarim"
"169","it is effective to some patients not all of them, hence i used the probability reasoning"
"170","It was really effective because 98% of the files i had reviewed shown a very good judgement on the cure Batatrim. i followed the instructions i was given before the review."
"171","I considered that there were patients who didn't need Batatrim to get healed, but the scale of those is a bit lower than the ones whom Batatrim was effective to. "
"172","While most patients who used Batatrim recovered from their crises there were also a number of those who did not. I would need more information about each patient to say the drugs is 100% effective. So that's why I took 7."
"173","The number of patients that healed from taking batatrim was higher than the number of patients that did not heal from batatrim, which proves its effectiveness"
"174","the number of those who took batatrism was more compare to those who did not and was more effective."
"175","Batatrim worked on most of my patients which im considering to have been about 80%, hence i have concluded it to have worked "
"176","I did a bit of probability and the person who has the crisis and take Batatrim had a greater chance of surviving by over 55% and contrary to this the chances were significantly much lower, basically a miracle to  survive it without Batatrim"
"177","In 7 out of 10 cases it was effective."
"178","There are so many patients who were cured."
"179","The number of patients who did not take it and recovered is way too low in comparison to the number of people who took it and recovered is high"
"180","In the observation phase the majority of the of patients who took batatrim overcame the disease while the majority of patients who did not take batatrim did not overcome the desease this clearly shows that a patient where to take batatrim they have a higher chance of overcoming the desease"
"181","that it was more likely that patients who had taken batatrim were better after than if they didn't"
"182","Batatrim helped the majority of patients to overcome the crisis, but not all of them did survive, but mostly they survived the crisis."
"183","There was only a handful of cases where patients who took Batatrim or patients patients who didn't take Batatrim recovered. This is why, for the most part, not fully, I think Batatrim is effective."
"184","the rate of patients cured who took batarim and those who did not take batarim"
"185","not all the patients who took the batatrim had overcome the crisis , and not all who didnt take the batatrim didnt overcome the crisis"
"186","In most of the scenarios given earlier, the NZ-6 hadn't followed the base responsibility it was originally intended for, i.e., even when it is activated, most of the time, it couldn't stop lamnetorex, which it should've, hence proving it's not reliable enough, making it inefficient and ineffective"
"187","In the patients' that I was provided with, I realised that many patients, about 70% who had taken Batatrium ended up surviving. Whereas for those who did not take Batatrium, many of them did not survive. This means that Batatrium is very effective."
"188","Almost all the people that took Batatrim were fine, so it was very effective"
"189","I considered the number of patients who overcame the crisis over those who did not"
"190","I observed the amount of people who recovered who had taken Batatrim and I saw that it increased the chances of recovery even though I was not allow constant in treating or helping in recovery."
"191","I seen in the observation phase that most of the patients who took Batatrim, overcome the disease. There were cases of people who took Batatrim, but haven't overcome the disease, but those cases were very rare. There were also cases when patients didn't take Batatrim, but were able to overcome the disease, but I think those cases were pure chance, as from the observation, I seen that the number people who didn't take Batatrim and didn't overcome were higher than people who didn't take Batatrim, and overcome. That's why, I can say Batatrim is 75-80% effective as it's still in testing phase."
"192","Well, I will say that I compared the recovery rates of both who took Batatrim and those who did not. I realized that some patients recovered from the crises even without the medication.I  concluded that irregardless of this ..use of Batatrim increases the chance of survival."
"193","Based on the sample, most of the patients who consume Batatrim have overcome the crisis"
"194","Without a consistent success rate across all subjects, the drug Batatrim cannot be labeled 'fully effective' yet. It could be that there are underlying factors, such as the severity of the condition, genetic differences, or lifestyle variables. "
"195","However there wasnt much information about Batatrim but from the report results I've noticed most of the patients who took batatrim has overcome it but there is still few patients who havent taken batatrim still ovecame the disease"
