"","X","participant","condition","date","t_consenso","t_istruzioni","t_sam","intensita","valenza","t_task","t_dual","vd_dual","OS","t_entity","entity","Reas1","Reas2","Reas3","Reas4","Reas5","Reas6","t_prev","prev","t_pr1","pr1","t_pr2","pr2","sexI","ageI","NLI","AoAI","sexE","ageE","NLE","AoAE","condition1","first"
"106",116,"Italian","A","2025-10-14_21h37.41.626",8.985,52.785,16.4,0.506944444,0.505555556,281.006,13.483,0,"MacIntel",0.001,NA,NA,NA,NA,NA,"suppongo che ci sia una correlazione, forse spuria, ma credo ci sia un'altra variabile che possa spiegare il legame causa-effetto.
",NA,16.05,56,14.55,57,15.617,48,"M",22,"italiano ",0,NA,NA,NA,NA,"a",1
"107",117,"Italian","M","2025-10-09_10h42.39.758",37.6689,94.4221,28.8408,0.641203774,0.395833333,228.6716,30.6409,0,"Win32",4e-04,NA,"Ho preso in considerazione il fatto che 5 pazienti tra quelli a cui è stato somministrato il Batatrim, non sono guariti. Se consideriamo che saranno stati circa 25 i pazienti sottoposti a questa cura, il batatrim ha una percentuale di fallimento circa del 25%, una percentuale abbastanza alta per un farmaco. ",NA,NA,NA,NA,NA,12.4668,88,13.259,95,10.6354,5,"M",22,"Italiano",0,NA,NA,NA,NA,"c",0
"108",118,"Italian","L","2025-10-11_15h19.39.344",6.5982,73.7693,31.5718,0.585648166,0.502314868,370.135,5.5829,1,"Win32",12.8092,7,NA,NA,"la maggior parte delle volte si è fermato",NA,NA,NA,33.9806,76,15.7571,95,19.7567,5,"FALSE",23,"italiana",0,NA,NA,NA,NA,"a",1
"109",119,"Italian","A","2025-10-11_15h19.38.279",16.7467,61.5742,30.3785,0.782407425,0.787037072,354.9764,5.8656,0,"Win32",0.0011,NA,NA,NA,NA,NA,"La probabilità di cambiare colore era nettamente alta sia nella variabile con fluffberry che nella variabile senza fluffberry, quindi qualora ci fosse una minima influenza la reputerei comunque insignificante o dotenzialmente dovuta al caso",NA,40.7444,50,19.7791,91,13.9308,91,"M",22,"italiano",0,NA,NA,NA,NA,"a",1
"110",120,"Italian","M","2025-10-13_10h55.18.867",61.4715,42.6351,27.6841,0.700231517,0.413194444,214.3632,53.3692,0,"Win32",0.0011,NA,"Ho cercato di considerare tutte le possibilità: molte volte il paziente ha superato la crisi dopo aver preso il Batatrim, ma più di qualche volta il paziente non ha superato la crisi nonostante avesse preso il Batatrim; inoltre, molte volte la crisi è stata superata senza il Batatrim.",NA,NA,NA,NA,NA,27.9667,70,23.2999,95,91.8751,30,"FALSE",23,"Italiano",0,NA,NA,NA,NA,"d",0
"111",121,"Italian","L","2025-10-13_15h26.00.740",41.4135,63.2811,37.9138,0.583333333,0.454861111,244.4158,8.5899,1,"Win32",14.4172,8,NA,NA,"Informazioni prese in considerazione:
- percentuale approssimativa di funzionamenti relativi all'attivazione della leva
- NON presa in considerazione la percentuale relativa ai funzionamenti a fronte della non attivazione del sistema NZ-6
Ragionamento:
- nonostante l'arresto del Laminatronix sembri, stando alla percezione delle percentuali relative al suo spegnimento, indipendente dall'attivazione del sistema, pare che in proporzione ci sia stato un minor numero di situazioni in cui è stato attivato e quindi una minor possibilità di escludere l'intervento di variabili esterne, che possono aver determinato l'arresto del macchinario anche senza l'uso del sistema, oltre che una, forze, maggior efficacia dell'NZ-6 nell'arrestare il Laminatronix",NA,NA,NA,27.1875,93,10.4815,98,16.6646,10,"M",22,"Italiano",0,NA,NA,NA,NA,"c",0
"112",122,"Italian","A","2025-10-21_15h23.30.805",40.9886,73.1712,34.9414,0.605794271,0.775065104,548.9934,5.4497,0,"Win32",0.0014,NA,NA,NA,NA,NA,"inizialmente ho provato a confermare l'ipotesi, poi a falsificarla e mi è sembrato che non vi fosse alcuna correlazione tra mangiare il fluffberry e il cambio di colore dell'alieno. Non sono riuscito a prevedere l'outcome del mangiare il fluffberry neanche dopo numerose risposte.",NA,43.9435,38,30.2487,33,60.5807,44,"M",21,"italiano",0,NA,NA,NA,NA,"c",0
"113",123,"Italian","M","2025-10-12_15h13.58.265",4.9168,59.8188,37.6519,0.251157407,0.659722258,230.4976,12.417,0,"Win32",0.0012,NA,"Essendo un farmaco in via di sperimentazione, è in fase di sperimentazione anche la sua efficacia che non è del 100% perchè in alcuni casi funziona e in altri no. Quindi bisogna prendere in esame altre variabili in gioco",NA,NA,NA,NA,NA,17.334,96,15.8837,85,12.7164,12,"FALSE",23,"Italiano",0,NA,NA,NA,NA,"b",1
"114",124,"Italian","L","2025-10-12_18h57.12.366",6.4495,73.1476,36.1012,0.5328125,0.4984375,277.8155,3.8312,1,"Win32",9.0655,8,NA,NA,"Ho cercato di cogliere dei  pattern ma non sono riuscita a capire la logica dietro dunque andavo per tentativi",NA,NA,NA,11.1663,96,10.4877,99,21.6602,4,"FALSE",24,"italiano",0,NA,NA,NA,NA,"a",1
"115",125,"Italian","A","2025-10-14_11h28.07.608",12.7315,41.9603,22.8634,0.50097583,0.69223269,237.3939,8.1645,0,"Win32",0.0013,NA,NA,NA,NA,NA,"Per quanto alcuni Yellowpop che avevano mangiato il Fluffberry avessero cambiato colore, la correlazione non era persistente, cioè, non tutti quelli che lo avevano mangiato cambiavano, come anche non tutti quelli che non lo avevano mangiato restavano dello stesso colore.",NA,17.6612,60,11.599,42,12.1985,40,"FALSE",22,"Italiano",0,NA,NA,NA,NA,"b",0
"116",126,"Italian","M","2025-10-13_18h43.24.178",50.5154,85.4867,70.5064,0.870370441,0.239583333,287.5623,18.175,1,"Win32",87.2838,6,"Ho cercato di ricordare la percentuale di pazienti che hanno superato la crisi dopo aver assunto il farmaco sul totale di pazienti che hanno assunto il farmaco e di confrontarla con la percentuale di pazienti che hanno superato la crisi senza averlo assunto sul totale di pazienti che non hanno assunto il farmaco e mi sembrava che il risultato non fosse molto differente se non di poco in favore del farmaco.",NA,NA,NA,NA,NA,44.291,90,56.4578,90,65.3633,20,"FALSE",23,"Italiano",0,NA,NA,NA,NA,"c",0
"117",127,"Italian","L","2025-10-13_16h34.43.606",9.0657,232.1963,26.2767,0.623611132,0.55277782,289.3402,4.6872,0,"Win32",0.0026,NA,NA,NA,"ci sono stati troppi casi in cui il sistema non ha funzionato ",NA,NA,NA,26.8964,73,25.292,92,69.2826,12,"FALSE",23,"italiano",0,NA,NA,NA,NA,"a",1
"118",128,"Italian","L","2025-10-14_21h00.44.938",27.4818,61.6103,21.3154,0.236111111,0.501157443,297.2754,13.2375,0,"Win32",8e-04,NA,NA,NA,"in alcune situazioni in cui diceva che le persone non fermavano il NZ-6, comunque il NZ-6 si fermava da solo oppure non si fermava. ",NA,NA,NA,16.1702,86,19.5482,99,18.3495,8,"FALSE",24,"italiano",0,NA,NA,NA,NA,"d",1
"119",129,"Italian","A","2025-10-19_22h12.54.880",39.717,51.267,34.484,0.648611111,0.625,226.505,5.349,0,"MacIntel",0.001,NA,NA,NA,NA,NA,"Ho considerato che quante volte restavano dello stesso colore senza mangiare il Fluffberry e ho notato che erano poche. La maggior parte delle volte avveniva il cambio del colore indipendentemente dal fatto che avessero mangiato o no il Fluffberry. ",NA,54.301,30,76.236,65,63.151,40,"FALSE",25,"italiano",0,NA,NA,NA,NA,"d",0
"120",130,"Italian","L","2025-10-20_09h40.24.136",29.1926,99.4062,36.8195,0.751157443,0.584490776,325.8517,18.1351,1,"Win32",107.8108,7,NA,NA,"quante volte il macchinario si è fermato quando la leva è stata attivata",NA,NA,NA,16.9698,72,12.6058,84,66.2655,32,"FALSE",26,"italiano",0,NA,NA,NA,NA,"d",0
"121",131,"Italian","M","2025-10-18_11h27.29.424",14.1631,54.2257,63.541,0.814814868,0.44212963,380.1571,3.4993,0,"Win32",0.0017,NA,"Ho pensato che non fosse efficace. All'inizio sembrava di si perchè sembrava che chi prendeva il farmaco superasse le crisi, poi però i risultati sembravano dimostrare che anche chi non lo prendeva poteva superarle. Quindi ho iniziato a pensare che non servisse molto il farmaco.",NA,NA,NA,NA,NA,20.0203,70,14.9636,90,11.6652,20,"FALSE",25,"Italiano",0,NA,NA,NA,NA,"a",1
"122",132,"Italian","L","2025-10-20_12h11.37.996",8.0829,51.2924,17.9993,0.631944444,0.579861111,230.2472,15.6768,1,"Win32",7.4953,7,NA,NA,"Stima di occasioni in cui attivando il sistema NZ-6 il macchinario si fermava",NA,NA,NA,8.434,65,11.4595,96,11.1566,30,"FALSE",29,"italiano",0,NA,NA,NA,NA,"c",0
"123",133,"Italian","A","2025-10-19_18h38.50.026",19.7485,57.4393,16.6669,0.706018554,0.857638907,267.1178,4.7938,0,"Win32",0.0015,NA,NA,NA,NA,NA,"mi è sembrato che i Fluffyellow cambiassero colore in modo casuale, e che aver mangiato o meno il Fluffberry non influisse sul cambio di colore. Faccio questa inferenza perché non sono riuscito a individuare uno schema di cambiamento del colore basato sul mangiare o non mangiare il Fluffberry ",NA,27.4072,0,22.1626,100,34.0348,50,"M",24,"italiano",0,NA,NA,NA,NA,"d",0
"124",134,"Italian","L","2025-10-20_21h06.03.153",11.9498,41.9676,18.2165,0.695270647,0.390257626,225.8874,4.4662,0,"MacIntel",0.001,NA,NA,NA,"Non ho contato quante volte la leva non è stata capace di fermare il sistema, ma ho semplicemente usato la memoria per ricordare che decisamente troppe volte il sistema non è stato efficace e quindi non può essere considerato un buon sistema.",NA,NA,NA,13.5987,80,21.0679,4,31.617,0,"M",22,"Italiano",0,NA,NA,NA,NA,"b",1
"125",135,"Italian","A","2025-10-20_22h59.04.257",24.5821,67.7823,28.7991,0.554398148,0.912037037,209.9753,5.5826,0,"Win32",5e-04,NA,NA,NA,NA,NA,"Non sono riuscito a contare i cambiamenti senza aver mangiato il frutto e quelli avendo mangiato il frutto, ma in ogni caso il cambiamento mi è sembrato arbitrario e senza uno schema",NA,49.7657,5,32.2159,95,36.9326,50,"M",25,"Italiano",0,NA,NA,NA,NA,"c",0
"126",136,"Italian","M","2025-10-21_21h01.52.653",8.099,42.215,14.833,0.31773667,0.652339499,179.53,3.566,0,"MacIntel",0.001,NA,"Il fatto che spesso, da quello che mi sembrava, il paziente superava la crisi anche senza il farmaco e che, anzi, spesso, quando lo prendeva, non lo superava",NA,NA,NA,NA,NA,12.632,82,8.315,36,8.65,53,"FALSE",22,"Italiano",0,NA,NA,NA,NA,"a",1
"127",138,"Prolific","A","2025-10-22_12h05.58.293",7.4163,44.9438,17.2565,0.600694444,0.90625,204.6826,3.7777,0,"Win32",2e-04,NA,NA,NA,NA,NA,NA,"Taking into acount that a lot of Yellowpops changed colors without eating the fulffberry, and a lot of them didn't change after eating one, it makes me think that Yellopops changing colors have nothing to do with the Fluffberry",16.6217,0,10.718,50,9.7771,50,NA,NA,NA,NA,"M",22,"Spanish",6,"a",1
"128",139,"Prolific","A","2025-10-22_15h57.53.849",4.732,29.866,12.1981,1,0.777777778,211.0524,5.6068,0,"Win32",0.0017,NA,NA,NA,NA,NA,NA,"Some of the aliens would change colour regardless of if they ate it or not. Some others would also stay the same regardless of if they ate it. At bare minimum, there does not seem to be any causation between the two.",26.1242,0,13.1988,50,9.6071,50,NA,NA,NA,NA,"M",24,"English",0,"a",1
"129",140,"Prolific","A","2025-10-22_16h02.27.529",17.3839,170.3842,24.5151,0.925,1,386.5599,6.9079,0,"Win32",0.0036,NA,NA,NA,NA,NA,NA,"Fluffberry was not effective because even when the yellowpop didn't eat the fuffberry at times it still changes color",20.051,30,9.2398,19,12.4675,35,NA,NA,NA,NA,"FALSE",23,"English ",1,"b",1
"130",141,"Prolific","A","2025-10-22_16h04.34.113",7.874,38.7969,13.3125,0.604166667,0.650462998,240.7319,3.4929,0,"Win32",0.0026,NA,NA,NA,NA,NA,NA,"They sometimes changed colours without eating the berry and they also sometimes didn't change colour when they ate it",10.7563,26,13.0102,50,13.315,27,NA,NA,NA,NA,"M",22,"English",0,"b",1
"131",142,"Prolific","A","2025-10-22_16h09.31.951",15.7633,57.2898,20.6806,0.832027893,0.693200842,271.4761,4.8488,0,"Win32",0.0039,NA,NA,NA,NA,NA,NA,"The number of times the alien change colour affect eating the fluffberry is equal to the amount of times the alien changed colours without eating any fluffberry",20.396,43,14.7476,11,14.0471,11,NA,NA,NA,NA,"M",21,"English, Igbo",0,"a",0
"132",145,"Prolific","A","2025-10-22_17h00.21.348",3.9859,37.197,10.4587,0.65,0.810416667,318.0235,4.8704,0,"Win32",6e-04,NA,NA,NA,NA,NA,NA,"Based on observations, I dont think there is a direct causation between eating Fluffberry and changing color.",15.1122,3,11.3596,80,10.5915,20,NA,NA,NA,NA,"M",23,"Polish",6,"a",1
"133",146,"Prolific","A","2025-10-22_17h02.57.731",21.9171,39.811,9.0879,0.327256944,0.691840278,159.0232,4.0115,0,"Win32",3e-04,NA,NA,NA,NA,NA,NA,"It doesn't matter if it eated the flufberry or not, sometimes it would change colors and others not",13.7584,7,15.176,42,6.4293,43,NA,NA,NA,NA,"M",24,"Spanish",4,"a",1
"134",147,"Prolific","A","2025-10-22_17h03.00.770",21.2319,64.3169,15.9451,0.662037037,0.825231464,200.4549,4.7591,1,"Win32",7.8482,8,NA,NA,NA,NA,NA,"In most cases, the Fluffberry was effective. Sometimes it did not, and usually that was when they ate it 2 times in a row.",13.6429,31,18.8216,75,11.1547,34,NA,NA,NA,NA,"M",24,"French",10,"a",1
"135",148,"Prolific","A","2025-10-22_17h04.12.368",17.525,52.404,29.063,0.646990705,0.840277795,218.59,3.533,0,"Win32",0,NA,NA,NA,NA,NA,NA,"There was at least 19 situation in which flufberry didn't have any influence over yellowpeople changing colour. It was a lot of such situations so it is hard to consider it as insignificant. The most convincing thing to me was the fact that some yellowpeople changed colour even when they didn't eat the fluffberry which shows that their coulour changing is not related to the fruit. So if not every yellowpeople who ate fluffberry turned green and some yellowpeople who didn't ate flufberry changed their colour then the asumption is false. ",41.631,20,25.67,50,22.714,20,NA,NA,NA,NA,"M",24,"polish",7,"a",1
"136",149,"Prolific","A","2025-10-22_17h05.54.426",16.6882,38.7282,15.0394,0.576388889,0.56712963,317.6183,22.738,0,"Win32",0.0039,NA,NA,NA,NA,NA,NA,"I considered the fact that the yellowpops would change color regardless of whether a fluffberry was eaten or not and also even when a yellowpop eats a fluffberry it wouldn't change color sometimes.",12.18,0,13.5348,59,8.5537,70,NA,NA,NA,NA,"M",22,"English",1,"a",1
"137",150,"Prolific","A","2025-10-22_17h10.35.747",10.429,74.263,16.563,0.631410256,0.727564103,251.545,6.601,1,"MacIntel",24.889,6,NA,NA,NA,NA,NA,"I looked at whether the Yellowpops ate the Fluffberry and if they changed color afterward. I compared the times they ate it with the times they didn’t. If they changed color more often after eating the Fluffberry, I thought it meant the Fluffberry was effective.",10.34,51,7.821,50,4.198,14,NA,NA,NA,NA,"FALSE",20,"IsiZulu ",7,"a",1
"138",151,"Prolific","A","2025-10-22_17h11.06.417",12.8618,31.0637,18.0152,0.731481481,0.497685185,178.8983,3.2381,0,"Win32",0.0019,NA,NA,NA,NA,NA,NA,"I considered if they changed colour based on if they ate the fluffberry or not, seemingly it didn't really have a rule, changing randomly, sometimes it felt like it did affect it and sometimes it didn't.",24.7718,15,12.4121,44,8.3577,68,NA,NA,NA,NA,"M",23,"Croatian",4,"c",0
"139",152,"Prolific","A","2025-10-22_17h11.35.979",6.0333,51.0134,19.5486,0.242838542,0.778320313,218.5436,13.2489,1,"Win32",8.0652,8,NA,NA,NA,NA,NA,"I considered the amount of times the yellow people changed colour after consuming the fluffberry which was high compared to when they changed colour when they did not eat the fluffberry, so I believe that the fluffberry has a high chance of being the cause.",48.1496,0,35.5379,80,39.3477,10,NA,NA,NA,NA,"FALSE",22,"English",0,"d",0
"140",153,"Prolific","A","2025-10-22_17h21.19.579",10.7452,38.8391,14.0411,0.513888889,0.878472222,185.7404,6.3955,0,"Win32",3e-04,NA,NA,NA,NA,NA,NA,"More yellowpops change colors without eating Fluffberry so there is no way that it was effective. ",11.1968,20,18.0484,45,21.1754,75,NA,NA,NA,NA,"M",24,"Polish",6,"c",0
"141",154,"Prolific","A","2025-10-22_17h21.34.883",60.6815,127.0961,66.1983,0.534179688,0.703450521,331.6308,20.8038,0,"Win32",0.0023,NA,NA,NA,NA,NA,NA,"I considered 'NO' because the yellowpop sometimes changes its color even if it didn't eat the fluffberry. At first, I thought maybe it was effective until the yellowpop didn't change color while it ate the fluffberry. Perhaps they is other situations or impacts that cause it to change color, rather than the fluffberry. While I understand that the yellowpop changes color multiple times when eating the fluffberry, it also didn't change color multiple times while it ate it, lastly, it also changed color multiple times while it didn't eat the fluffberry.",45.7182,50,21.2777,77,51.493,51,NA,NA,NA,NA,"M",18,"Zulu and English",2,"a",1
"142",155,"Prolific","A","2025-10-22_17h22.42.086",77.336,77.328,23.4246,1,0.750651042,414.998,14.0556,1,"Win32",23.5614,8,NA,NA,NA,NA,NA,"I considered the fact that almost all the yellowpops that ate the fluffberry changed color. It shows that the fluffberry has something to do with the change of color.",13.525,0,18.227,80,42.4037,20,NA,NA,NA,NA,"M",20,"Xitsonga, English and Sepedi",0,"b",1
"143",156,"Prolific","A","2025-10-22_17h31.52.756",18.1947,130.5592,71.4013,0.862268554,0.88657418,286.9289,6.8493,1,"Win32",17.9825,7,NA,NA,NA,NA,NA,"When a fluffberry is eaten by the yellowpop, it changes color. Therefore the fluffberry is effective.",28.0495,60,16.0995,85,17.7497,20,NA,NA,NA,NA,"M",19,"English",0,"c",0
"144",157,"Prolific","A","2025-10-22_17h41.43.911",19.5658,104.0945,14.2859,0.965277742,0.931712998,221.4627,6.182,1,"Win32",7.0028,7,NA,NA,NA,NA,NA,"The correct answer to whether Fluffberry had changed colour was correct more times than when it hadn't changed colour.",12.1713,66,29.1814,55,20.7971,80,NA,NA,NA,NA,"FALSE",21,"English, Xhosa, Zulu",0,"a",1
"145",158,"Prolific","A","2025-10-22_17h50.43.792",24.1738,52.5123,26.1168,0.878472222,0.84375,322.1919,5.2661,1,"Win32",15.1382,7,NA,NA,NA,NA,NA,"I think it kinda make something with it, like speed up the changing colors. Most of them who eaten the fruit more likely to change the color. Most of them who eaten the fruit changed the color but not everyone.",25.9622,65,19.9684,75,22.2169,30,NA,NA,NA,NA,"M",24,"Polish",7,"a",1
"146",159,"Prolific","A","2025-10-22_18h23.22.108",45.415,232.2204,11.5182,0.893210588,0.853904019,239.8028,4.1633,0,"Win32",4e-04,NA,NA,NA,NA,NA,NA,"Sometimes, when yellowpops eat the fluffbery it changes color and some times not. Also, in some observations the yellowpops did not eat the fluffberry and they even changed color",12.3455,0,7.9639,18,15.8868,0,NA,NA,NA,NA,"M",19,"Arabic",6,"b",1
"147",160,"Prolific","A","2025-10-22_20h37.20.050",5.1109,54.7995,26.5973,0.884259224,0.717592628,200.582,6.4714,0,"Win32",9e-04,NA,NA,NA,NA,NA,NA,"I reviewed all the cases and compared the outcomes between those who consumed the Fluffberry and those who didn't. Since similar colour changes occurred in both groups, I concluded that Fluffberry didn't have a noticeable effect.",15.8673,32,14.0272,41,8.777,62,NA,NA,NA,NA,"M",18,"Hindi, English",0,"b",1
"148",161,"Prolific","A","2025-10-22_22h06.39.514",62.6512,110.3356,15.6667,1,0.488195173,294.9086,6.1832,1,"Win32",9.9667,7,NA,NA,NA,NA,NA,"Base on the some sort like pattern like the emotion when you hungry you will feel angry. The color changes with it emotion.",17.4669,70,13.9667,70,22.0506,73,NA,NA,NA,NA,"M",20,"Viet Nam",8,"a",0
"149",162,"Prolific","A","2025-10-23_11h07.12.513",13.1582,201.841,80.0066,0.758256626,0.70869236,404.6674,2.4513,1,"MacIntel",3.8883,7,NA,NA,NA,NA,NA,"About 6-7 times out of ten the fluffberry would change the colour however there were anomalies a few times, so it wasnt guaranteed to change the colour but most of the times it did.",5.3017,61,2.5835,65,9.3048,73,NA,NA,NA,NA,"M",24,"English",0,"b",1
"150",163,"Prolific","A","2025-10-23_12h09.00.504",14.5945,49.5838,18.6106,0.598306202,0.699637024,239.7339,89.869,1,"Win32",6.1138,4,NA,NA,NA,NA,NA,"Most of those who changed color ate Fluffberries, but that's not always the case. But it might have some significance.",24.5918,4,12.5457,80,14.0445,52,NA,NA,NA,NA,"FALSE",24,"Polish",5,"a",1
"151",164,"Prolific","M","2025-10-23_12h41.02.581",7.3499,30.1663,10.9499,0.583333333,0.270833333,279.1158,3.1663,0,"Win32",2e-04,NA,NA,"I considered whether the patient will overcome the disease",NA,NA,NA,NA,8.3358,51,12.814,49,95.4163,31,NA,NA,NA,NA,"M",23,"Cantonese",3,"a",1
"152",165,"Prolific","M","2025-10-23_12h58.10.919",17.2596,36.5224,12.4498,0.736111111,0.915509259,199.0176,2.2466,1,"Win32",5.749,8,NA,"it helped in almost every case where they used it, but it also wasnt needed in the cases where batatrim wasnt taken",NA,NA,NA,NA,8.848,71,14.1112,80,12.3652,20,NA,NA,NA,NA,"FALSE",22,"Spanish",8,"c",1
"153",166,"Prolific","A","2025-10-23_13h03.46.653",61.8112,96.3121,32.2071,0.857638889,0.793981552,296.0978,16.1663,0,"Win32",0.0015,NA,NA,NA,NA,NA,NA,"1. The probability that the yellow pops changed color was high weather the fluffberry was consumed or not. 
2. Initially there was an association between colour change and consumption of the berry but after analysis it showed that the re was no association and that color change is influenced by something else",20.7913,30,20.6727,71,20.8326,63,NA,NA,NA,NA,"M",23,"ENGLISH SWAHILI",0,"a",1
"154",167,"Prolific","L","2025-10-23_13h40.53.467",19.3312,35.6658,14.0523,0.677083333,0.392361111,263.2696,4.9118,1,"Win32",5.128,7,NA,NA,NA,"I think most times it made the machine stop, i estimated",NA,NA,8.612,76,8.4748,85,9.7602,10,NA,NA,NA,NA,"M",23,"Portuguese",5,"a",1
"155",168,"Prolific","L","2025-10-23_13h48.53.105",19.986,65.3468,27.075,0.577546296,0.671296296,225.2139,3.62,1,"Win32",12.8458,7,NA,NA,NA,"Most of the times the NZ-6 system was used, the machine stopped. It wasn't perfect and it didn't stop a couple of times even after pushing the lever, but overall I think it was effective.",NA,NA,207.7357,75,13.529,75,25.358,55,NA,NA,NA,NA,"M",23,"Portuguese",6,"c",0
"156",169,"Prolific","L","2025-10-23_13h54.50.749",10.7776,26.6845,11.9224,0.578703704,0.420138889,507.7952,3.3995,0,"Win32",5e-04,NA,NA,NA,NA,"I tried to do it according to the system however the results were varied sometimes it was correct and other times it was not so I'm not entirely sure on the effectiveness.",NA,NA,14.9537,56,9.8512,41,5.0153,58,NA,NA,NA,NA,"M",24,"English",0,"b",1
"157",170,"Prolific","L","2025-10-23_13h55.23.271",6.533,54.5185,31.5344,0.838624339,0.871693122,307.422,19.4333,1,"Win32",112.0711,7,NA,NA,NA,"I considered the system’s goals, the results it produced compared to expectations, user feedback, and any data showing improvements or issues, then reasoned whether those outcomes aligned with its intended purpose to judge its overall effectiveness.",NA,NA,130.689,83,14.8839,66,2.2505,72,NA,NA,NA,NA,"M",20,"English",0,"c",1
"158",171,"Prolific","L","2025-10-23_13h59.59.939",26.9161,113.3183,37.2503,0.817381215,0.598039241,330.7418,10.667,1,"Win32",22.1003,7,NA,NA,NA,"I considered the data from the experiment, and observed that overall the datapoints seemed more favoring for the NZ-6 system, but subtly.",NA,NA,65.4889,41,36.4498,82,41.2832,38,NA,NA,NA,NA,"FALSE",24,"Arabic",14,"c",0
"159",172,"Prolific","L","2025-10-23_14h40.25.075",27.549,67.8487,19.3275,1,0.514375184,291.398,4.2448,0,"Win32",0.0017,NA,NA,NA,NA,"The machine seemed to stop even when the NZ-6 system was inactivated. It almost appeared as if the system was an option and an unpredictable option at that.",NA,NA,32.4028,0,29.7583,10,17.9341,50,NA,NA,NA,NA,"FALSE",24,"Xhosa, Zulu, Sotho, Tswana, Afrikaans.",4,"c",0
"160",173,"Prolific","L","2025-10-23_14h41.34.674",27.4826,90.0594,43.0476,0.717013889,0.66218533,241.1341,4.0808,0,"Linux x86_64",6e-04,NA,NA,NA,NA,"In most cases, when the NZ-6 was activated, the laminatorix did not stop, and in some cases it stopped without the NZ-6 being activated.",NA,NA,32.4861,55,23.8489,75,37.2869,20,NA,NA,NA,NA,"M",24,"isiXhosa",5,"c",0
"161",174,"Prolific","L","2025-10-23_14h42.10.430",16.1585,105.9155,35.2575,0.213541667,0.579752604,241.6889,6.0669,1,"Win32",16.1499,9,NA,NA,NA,"The NZ-6 system was very effective as it was able to stop the Laminatorix almost every time it was activated. so 9 times out of 10 the system was effective.",NA,NA,51.1065,75,11.0668,90,17.5819,10,NA,NA,NA,NA,"M",23,"English",0,"a",1
"162",175,"Prolific","L","2025-10-23_14h42.32.004",25.7832,138.4091,41.9021,0.685185185,0.52662037,386.3264,6.168,0,"Win32",0.0012,NA,NA,NA,NA,"i used the basis that the NZ-6 system is meant to stop the system however upon my observations i found the system to work about 65% of the time, so this system isn't effective and cannot be relied upon.",NA,NA,16.6766,65,31.2931,100,28.908,100,NA,NA,NA,NA,"M",19,"Sepedi",5,"a",1
"163",176,"Prolific","L","2025-10-23_14h44.05.496",7.9716,45.5942,9.6021,0.496527831,0.50115739,548.9564,3.1998,1,"Win32",4.6204,7,NA,NA,NA,"Its somewhat effective however it could also not work at all. Its confusing and difficult to say for sure whether it is effective or not.",NA,NA,10.3695,50,7.2801,50,8.4403,50,NA,NA,NA,NA,"M",21,"English",0,"b",1
"164",177,"Prolific","L","2025-10-23_14h45.11.170",33.3612,56.7431,15.1562,0.681712963,0.695601852,219.0892,6.7116,0,"Win32",6e-04,NA,NA,NA,NA,"It wasn't effective at all, because it didn't stop machine all the time. ",NA,NA,25.3785,91,35.6728,95,32.5097,3,NA,NA,NA,NA,"M",20,"Polish",6,"c",0
"165",178,"Prolific","L","2025-10-23_14h46.37.670",20.755,143.4343,58.6827,0.787203907,0.78373336,350.7634,5.2618,1,"Linux armv81",11.6489,7,NA,NA,NA,"Majority of the tests proved that the system managed to stop the Laminatorix machine.",NA,NA,31.1257,80,22.1977,62,14.1856,65,NA,NA,NA,NA,"M",23,"English",0,"b",1
"166",179,"Prolific","L","2025-10-23_14h55.01.239",32.3005,66.1182,22.5005,0.820856825,0.809297607,226.2462,6.3667,1,"Win32",22.817,7,NA,NA,NA,"In most cases, the lever has been able to stop the system, although on some occasions it has not been possible.",NA,NA,21.9671,95,17.9669,99,28.7672,50,NA,NA,NA,NA,"M",24,"Spain, Valencian",3,"a",1
