"","X","participant","condition","date","t_consenso","t_istruzioni","t_sam","intensita","valenza","t_task","t_dual","vd_dual","OS","t_entity","entity","Reas1","Reas2","Reas3","Reas4","Reas5","Reas6","t_prev","prev","t_pr1","pr1","t_pr2","pr2","sexI","ageI","NLI","AoAI","sexE","ageE","NLE","AoAE","condition1","first"
"167",180,"Prolific","L","2025-10-23_14h56.26.314",15.6066,18.2551,19.1968,0.311342646,0.732638871,195.2642,3.6553,0,"Win32",5e-04,NA,NA,NA,NA,"I hoped that it will be effective against the system",NA,NA,15.5137,66,10.5992,72,5.1538,21,NA,NA,NA,NA,"M",22,"hungarian",8,"a",0
"168",181,"Prolific","L","2025-10-23_14h58.33.795",44.2013,43.1719,64.8939,0.727864583,0.355143229,993.1952,55.5692,0,"Win32",0.0019,NA,NA,NA,NA,"i considered the information that i was given at firtst but only to find out that it is not true",NA,NA,24.7865,0,30.5652,98,13.7805,99,NA,NA,NA,NA,"M",23,"english",0,"c",0
"169",182,"Prolific","L","2025-10-23_15h40.18.267",41.8132,62.2326,23.8154,0.604286321,0.560016654,216.4393,6.8478,1,"MacIntel",7.7828,7,NA,NA,NA,"I considered the number of times when the laminatorix stopped when the NZ-6 system was switched on relative to the number of times when the laminatorix didn't stop when that system was switched on. Based on my recollection, in most times laminatorix stopped when that system was activated. ",NA,NA,13.8325,83,15.9192,97,24.1133,25,NA,NA,NA,NA,"FALSE",23,"Ukrainian",5,"c",0
"170",183,"Prolific","L","2025-10-23_15h44.31.946",15.8475,81.1143,14.5491,0.306712998,0.444444497,224.2389,3.933,0,"Win32",5e-04,NA,NA,NA,NA,"so i think that around 80 % the machine will stop while using the nz6 but i think this is not a good number to count on . This system should have 100% because this a safety issue ",NA,NA,17.5013,83,11.6988,99,12.7509,30,NA,NA,NA,NA,"M",22,"greek ",9,"c",0
"171",184,"Prolific","L","2025-10-23_15h47.38.392",13.4154,97.0027,18.937,0.85069448,0.523148148,451.8709,5.2863,1,"Win32",10.5753,8,NA,NA,NA,"yes as the system managed to stop most of the NZ-6 ",NA,NA,32.7362,26,15.6785,62,8.7476,40,NA,NA,NA,NA,"M",22,"English",0,"c",0
"172",186,"Prolific","M","2025-10-23_16h49.07.454",8.89,99.1999,13.0713,0.631944444,0.634259259,339.6271,16.968,1,"Win32",14.9043,8,NA,"it was effective has like 75 - 80 % were treated 






",NA,NA,NA,NA,12.2549,80,11.873,90,10.4562,94,NA,NA,NA,NA,"M",22,"English ",2,"c",1
"173",187,"Prolific","M","2025-10-23_16h49.29.101",10.2325,26.0335,22.3166,0.262988281,0.681305804,179.3957,3.5661,1,"MacIntel",10.133,4,NA,"most people that took batatrim overtook the crisis so my logic was that the treatment had at least helped a little,while some people that also took batatrim didn´t make it, the majority did so that made me believe that at least it had an impact  ",NA,NA,NA,NA,15.4167,65,15.6007,78,12.8999,46,NA,NA,NA,NA,"M",22,"Portuguese",6,"a",1
"174",188,"Prolific","M","2025-10-23_16h51.28.865",15.2003,53.9517,17.8335,0.323166233,0.400526259,214.012,2.8985,0,"MacIntel",7e-04,NA,NA,"it seemed equally likely that a person would or would not recover regardless of batatrim ",NA,NA,NA,NA,8.716400001,75,20.2669,68,7.1832,37,NA,NA,NA,NA,"FALSE",21,"english ",0,"a",1
"175",189,"Prolific","M","2025-10-23_16h51.57.328",7.9358,98.4604,11.4207,0.518929144,0.490215003,217.0413,2.1002,1,"Linux x86_64",4.7509,7,NA,"Most patients that had taken Batatrim overcame the syndrome when i was answering the questions and there was a higher chance as stated",NA,NA,NA,NA,6.7686,72,12.3212,71,5.0171,74,NA,NA,NA,NA,"M",22,"english",0,"a",1
"176",190,"Prolific","M","2025-10-23_16h55.51.757",8.5571,43.3063,26.9563,0.394097222,0.655381944,331.2027,6.0549,1,"Win32",3.5957,6,NA,"Becuase while there were some patients that have managed to recover by using Batatrim , there were alot of cases aswell in which people that were using it didn't recover, also people who don't use it that have recoved.",NA,NA,NA,NA,15.5114,70,7.7594,70,11.3131,42,NA,NA,NA,NA,"M",22,"Romanian",10,"c",0
"177",191,"Prolific","M","2025-10-23_17h49.31.192",12.1964,34.5513,17.981,0.838785047,0.557113188,248.444,2.4036,0,"Win32",3e-04,NA,NA,"It felt like Batatrim wasn't efficient at all, and patients could still fail, it felt almost random in failing or not, probably due to other factors with the patient, allergies and more",NA,NA,NA,NA,18.4462,87,18.1071,40,15.7765,60,NA,NA,NA,NA,"M",19,"Polish",7,"a",1
"178",192,"Prolific","M","2025-10-23_17h51.34.111",56.2461,80.1941,23.0977,0.760416667,0.373842593,247.4631,16.1985,0,"Win32",0.0017,NA,NA,"I tried to keep average of people that Batatrim did not help, and people that it helped. And I think I have noticed that treatment wasnt a main factor in their recovery.",NA,NA,NA,NA,19.7981,91,12.0157,65,25.8954,46,NA,NA,NA,NA,"M",23,"Polish",4,"a",1
"179",193,"Prolific","M","2025-10-23_17h52.36.367",9.819,48.374,24.417,0.986111111,0.306763285,208.329,3.809,1,"MacIntel",4.657,6,NA,"The number of people who overcame the crisis was more than those who did not yet healed.",NA,NA,NA,NA,9.121,52,9.287,27,9.904,16,NA,NA,NA,NA,"FALSE",21,"English ",0,"c",0
"180",194,"Prolific","M","2025-10-23_17h52.37.081",22.4396,62.8889,21.1917,0.555555582,0.728298664,280.2828,9.2461,1,"Win32",9.2247,7,NA,"I think that it was more effective beacouse almost every patient that took it overcome the disesse",NA,NA,NA,NA,13.8865,82,15.5521,69,13.9191,28,NA,NA,NA,NA,"M",22,"Polish",10,"a",1
"181",195,"Prolific","M","2025-10-23_17h53.05.596",7.18,75.7641,13.0492,0.440972222,0.431712963,324.135,6.9174,0,"Win32",0.0021,NA,NA,"It was not significantly effective, it seems that  the drug worked/was effective the same as no treatment. It could go either way, it's not convincing.",NA,NA,NA,NA,14.2827,62,30.2831,75,25.0316,35,NA,NA,NA,NA,"M",24,"Setswana",7,"c",0
"182",196,"Prolific","M","2025-10-23_17h54.44.774",31.5452,462.7951,33.3763,0.105324074,0.278935185,405.6436,18.0125,1,"Win32",7.1651,7,NA,"more people who took Batarim overcame their illness",NA,NA,NA,NA,10.8483,62,9.5149,75,12.7481,47,NA,NA,NA,NA,"M",24,"Xhosa/Zulu",6,"b",1
"183",197,"Prolific","M","2025-10-23_17h55.27.802",17.4468,41.8126,14.1377,0.115885417,0.120768229,210.8661,3.0446,1,"Win32",53.6038,9,NA,"Yes I did consider it before answering",NA,NA,NA,NA,15.7084,89,8.9069,90,10.2991,86,NA,NA,NA,NA,"M",21,"Englih",0,"d",0
"184",199,"Prolific","M","2025-10-23_17h57.39.340",6.1498,34.6429,19.7671,0.921874977,0.580729149,176.844,3.6333,0,"Win32",4e-04,NA,NA,"i tried to remember more or less the % of answers in which it was effective or not. I'd say that using it or not would have a difference of at most 10%, but it's just napkin math from what i can remember",NA,NA,NA,NA,11.2089,100,14.017,76,29.7838,69,NA,NA,NA,NA,"M",23,"italian",8,"d",0
"185",200,"Prolific","M","2025-10-23_18h00.22.896",13.8204,39.0153,19.8992,0.762152751,0.426215278,227.7123,3.4936,0,"Win32",4e-04,NA,NA,"Most people were overcoming the crisis with or without the Batatrim, and even with Batatrim they still somehow didnt recover",NA,NA,NA,NA,11.3597,50,9.093,72,9.8916,78,NA,NA,NA,NA,"M",23,"english",0,"c",0
"186",201,"Prolific","M","2025-10-23_18h04.06.277",23.1567,111.458,29.1003,0.78587963,0.805555556,267.2481,8.49,1,"Win32",12.8686,8,NA,"I believe Batatrim is effective because I observed a significantly higher number of patients who were successfully cured after taking it compared to those who didn't take it and didn't recover.",NA,NA,NA,NA,25.1046,80,26.9857,70,17.6965,20,NA,NA,NA,NA,"M",24,"English",0,"b",1
"187",202,"Prolific","M","2025-10-23_18h10.34.068",20.2951,68.4819,13.4867,0.639973958,0.552083333,436.9077,6.7293,1,"Win32",4.7113,9,NA,"It effective because it stopped bacterias from making folic acid ",NA,NA,NA,NA,6.4065,85,8.3076,66,4.5774,70,NA,NA,NA,NA,"M",20,"English",1,"a",1
"188",203,"Prolific","L","2025-10-23_18h15.48.132",42.4957,124.9398,38.75,0.759259277,0.71527776,280.1374,9.6995,0,"Win32",0.0011,NA,NA,NA,NA,"As I was going through the story , I read that in case we used the NZ-6 system lever the laminatorix machine can be stopped. But here in many cases even after we used NZ-6 system the machine did not stop. So it was not effective.",NA,NA,25.9508,77,12.8389,89,32.4375,17,NA,NA,NA,NA,"M",23,"Hindi, English",0,"a",1
"189",204,"Prolific","M","2025-10-23_18h37.12.983",61.412,88.675,24.817,0.657877604,0.298177083,240.646,5.284,1,"Win32",15.083,7,NA,"i answered based on the task that i did",NA,NA,NA,NA,17.117,66,15.849,43,18.637,25,NA,NA,NA,NA,"M",21,"english",2,"c",0
"190",205,"Prolific","M","2025-10-23_18h51.10.458",18.6737,41.7242,73.0534,0.81134261,0.28587963,188.7474,2.0967,1,"Win32",13.5627,9,NA,"over 80% of patients have overcome the crisis with the medicine so it's effective and without it the chances down to about 40%",NA,NA,NA,NA,15.8187,90,8.9033,80,15.1382,40,NA,NA,NA,NA,"M",24,"Arabic",5,"c",0
"191",206,"Prolific","L","2025-10-23_19h01.59.090",39.4676,72.3186,36.4505,0.642361111,0.506944444,282.235,8.6167,0,"Win32",7e-04,NA,NA,NA,NA,"the number of times when the machine stopped without using the system is more than the times the machine stopped when the system was used. So, I think the system is not effective.",NA,NA,16.2661,40,16.7737,39,16.9668,61,NA,NA,NA,NA,"FALSE",21,"Bengali, Hindi",5,"a",1
"192",207,"Prolific","L","2025-10-23_19h42.32.740",18.3994,116.2493,50.6492,0.718589179,0.552160922,717.8454,27.8658,0,"MacIntel",6e-04,NA,NA,NA,NA,"I observed that the laminatorix did not stop even when the nz-6 system lever was activated. This indicateds that the nz-6 system was no effective in stopping the machine. Therefore, i concluded that system was ineffective based on direct observation of its performance",NA,NA,45.1662,72,49.3162,80,36.3663,65,NA,NA,NA,NA,"M",23,"Vietnamese",6,"c",0
"193",208,"Prolific","M","2025-10-23_22h52.57.588",53.7491,334.6168,28.8491,1,0.417824092,225.6933,23.8656,1,"Win32",19.2991,4,NA,"a lot of patients does take Batatrim and still go over crisis, and sometime the Batatrim does not get patient out of crisis. 
It confuse me more just by reading text and imagine the whole context. not enough information to decide the effective.
I think it slightly effective",NA,NA,NA,NA,21.3145,33,19.7981,86,30.5483,66,NA,NA,NA,NA,"M",23,"Vietnamese",15,"a",1
"194",209,"Prolific","M","2025-10-24_12h58.45.271",4.5751,35.2528,16.9623,0.760416667,0.398148219,224.1636,6.2905,1,"Win32",16.5101,7,NA,"Those who took Batatrim had a high chance of being recovered from the disease, because most of the people who took it, were recovered. But the problem is, that also a good amount of people who had the disease and didn't take Batatrim were also recovered, so we can't prove how effective Batatrim really is",NA,NA,NA,NA,17.0919,75,52.2192,75,35.7805,33,NA,NA,NA,NA,"M",24,"German",8,"d",0
"195",210,"Prolific","M","2025-10-24_13h00.38.580",41.45,57.954,40.319,0.331018519,0.409722222,205.948,3.18,0,"Win32",0,NA,NA,"The illness was more like an influensa rather than a strong illness. Most people without Batatrim survived it and most of the ones who took it happened to not survive. I think it's a placebo",NA,NA,NA,NA,29.834,70,19.134,80,17.085,60,NA,NA,NA,NA,"M",24,"Hungarian",10,"c",1
